{
  "$schema": "https://json-schema.org/draft/2020-12/schema",
  "$id": "https://lubricant-rd.local/domains/lubricant/schemas/doe_input.schema.json",
  "title": "DOE input",
  "type": "object",
  "properties": {
    "input_type": { "enum": ["MIXTURE_DOE_DESIGN", "FACTORIAL_DOE_DESIGN", "MIXTURE_PROCESS_DOE_DESIGN"] },
    "project_type": {
      "description": "Optional route marker, purely additive (grease step 8). Only the exact value PRECISION_GREASE_DEV activates the grease-route rules (small sequential rounds of 3-6 samples per round, honest sequential method name, bench-schedule hard constraint). Absent or any other value keeps the pre-existing oil-route behaviour byte for byte. The skill layer fills this from the validated project artifact, whose project_type enum is the authority.",
      "type": "string",
      "minLength": 1
    },
    "bench_artifact": {
      "description": "Optional registered bench object (grease step 8, plan section 7.2 D-4). The engine consumes exactly one field of it: available_bench_slots, the value DERIVED by bench-registration (floor(usable_days/cycle_days) summed over availability_window, asserted by validate_bench_artifact.py). Supplying it turns the hand-filled resource_envelope.bench_slots into a checked declaration: a contradiction is rejected, and the design size must not exceed the derived capacity. The embedded artifact is validated by its own authority contract (bench.schema.json); this container deliberately stays open instead of mirroring that contract, so the two lists cannot drift.",
      "type": "object",
      "properties": {
        "available_bench_slots": {
          "description": "DERIVED by bench-registration, never hand-set.",
          "type": "integer",
          "minimum": 0
        }
      },
      "required": ["available_bench_slots"]
    },
    "design_space_reference": { "type": "string", "minLength": 1 },
    "components": {
      "type": "array",
      "minItems": 3,
      "maxItems": 12,
      "items": {
        "type": "object",
        "properties": {
          "component_id": { "type": "string", "pattern": "^[A-Za-z0-9][A-Za-z0-9._-]*$" },
          "lower_bound": { "type": "number", "minimum": 0, "maximum": 1 },
          "upper_bound": { "type": "number", "minimum": 0, "maximum": 1 }
        },
        "required": ["component_id", "lower_bound", "upper_bound"],
        "additionalProperties": false
      }
    },
    "mixture_total": { "type": "number", "exclusiveMinimum": 0, "maximum": 1 },
    "resource_envelope": {
      "description": "WP-04b resource envelope for the factor / process channels. bench_slots is the number of concurrent bench positions available for the NEXT round; its conversion basis references `bench.availability_window` (WP-05) and is documented rather than enforced here because the bench object does not exist yet. Fields are declared, not silently defaulted: the engine reports whatever it cannot yet consume. Optional in the compute contract (backward compatible with pre-WP-04b inputs); required on the experiment_design request for the factor families.",
      "type": "object",
      "properties": {
        "bench_slots": { "type": "integer" },
        "lot_capacity": { "type": "integer" },
        "cycle_days": { "type": "number" },
        "cost_cap": { "type": "number" },
        "external_test_lead_time": { "type": "number" }
      },
      "required": ["bench_slots", "lot_capacity", "cycle_days", "cost_cap", "external_test_lead_time"],
      "additionalProperties": false
    },
    "process_factor_role": {
      "description": "WP-04b: process-level split-plot role, mirroring process.schema.json factor_role. A factor that omits its own `role` inherits this value, so the whole/sub-plot direction is decided by process data and never hardcoded in the engine.",
      "enum": ["WHOLE_PLOT", "SUB_PLOT"]
    },
    "factors": {
      "description": "Independent (not mixture-closed) design dimensions. WP-04a supports two-level factors only: a factor varies between exactly two levels (explicit levels[] or a range[low,high]) or is held constant at hold_at and contributes no column. role records the split-plot structure: WHOLE_PLOT factors are hard to change, SUB_PLOT factors are reset per run. This role is orthogonal to design_space.constraint_role. WP-04b: role is optional per factor and falls back to process_factor_role.",
      "type": "array",
      "minItems": 1,
      "maxItems": 12,
      "items": {
        "type": "object",
        "properties": {
          "factor_id": { "type": "string", "pattern": "^[A-Za-z0-9][A-Za-z0-9._-]*$" },
          "factor_type": { "enum": ["CONTINUOUS", "DISCRETE"] },
          "role": { "enum": ["WHOLE_PLOT", "SUB_PLOT"] },
          "levels": { "type": "array", "minItems": 2, "maxItems": 2, "items": { "type": "number" }, "uniqueItems": true },
          "range": {
            "type": "object",
            "properties": { "lower": { "type": "number" }, "upper": { "type": "number" } },
            "required": ["lower", "upper"],
            "additionalProperties": false
          },
          "hold_at": { "type": "number" },
          "unit": { "type": "string", "minLength": 1 }
        },
        "required": ["factor_id", "factor_type"],
        "additionalProperties": false,
        "oneOf": [
          { "required": ["levels"], "properties": { "range": false, "hold_at": false } },
          { "required": ["range"], "properties": { "levels": false, "hold_at": false } },
          { "required": ["hold_at"], "properties": { "levels": false, "range": false } }
        ]
      }
    },
    "whole_plot_replicates": { "type": "integer", "minimum": 1 },
    "design_type": {
      "description": "Grease step 8 (purely additive enum value): RESOURCE_CONSTRAINED_GREEDY_SEQUENTIAL is the honest name for what the engine actually runs on this channel -- deterministic greedy selection from candidate lattice points, not model-driven sequential design (there is no Gaussian process). BAYESIAN_SEQUENTIAL stays a working alias and keeps emitting its legacy method string, so pre-rename inputs are unchanged.",
      "enum": ["SIMPLEX_MIXTURE", "D_OPTIMAL_MIXTURE", "FULL_FACTORIAL", "FRACTIONAL_FACTORIAL", "SPLIT_PLOT", "TAGUCHI_ROBUST", "BAYESIAN_SEQUENTIAL", "RESOURCE_CONSTRAINED_GREEDY_SEQUENTIAL"]
    },
    "model_order": { "enum": ["LINEAR", "QUADRATIC"] },
    "target_runs": { "type": "integer", "minimum": 0 },
    "responses": {
      "type": "array",
      "minItems": 1,
      "items": {
        "type": "object",
        "properties": {
          "ctq_reference": { "type": "string", "minLength": 1 },
          "test_method_reference": { "type": "string", "minLength": 1 },
          "role": { "enum": ["OPTIMIZATION_RESPONSE", "GUARDRAIL", "DIAGNOSTIC_RESPONSE"] }
        },
        "required": ["ctq_reference", "test_method_reference", "role"],
        "additionalProperties": false
      }
    },
    "experiment_card": {
      "type": "object",
      "properties": {
        "decision_question": { "type": "string", "minLength": 1 },
        "hypothesis": { "type": "string", "minLength": 1 },
        "variables_note": { "type": "string", "minLength": 1 },
        "constraints_note": { "type": "string", "minLength": 1 },
        "responses_note": { "type": "string", "minLength": 1 },
        "doe_selection_reason": { "type": "string", "minLength": 1 },
        "expected_information_value": { "type": "string", "minLength": 1 },
        "decision_rule": { "type": "string", "minLength": 1 }
      },
      "required": ["decision_question", "hypothesis", "variables_note", "constraints_note", "responses_note", "doe_selection_reason", "expected_information_value", "decision_rule"],
      "additionalProperties": false
    }
  },
  "required": ["input_type", "design_type", "model_order", "target_runs", "responses", "experiment_card"],
  "additionalProperties": false,
  "allOf": [
    {
      "if": { "properties": { "input_type": { "const": "MIXTURE_DOE_DESIGN" } }, "required": ["input_type"] },
      "then": {
        "required": ["components", "mixture_total"],
        "properties": { "factors": false, "whole_plot_replicates": false, "resource_envelope": false, "process_factor_role": false }
      }
    },
    {
      "if": { "properties": { "input_type": { "const": "FACTORIAL_DOE_DESIGN" } }, "required": ["input_type"] },
      "then": {
        "required": ["factors", "design_space_reference"],
        "properties": { "components": false, "mixture_total": false }
      }
    },
    {
      "if": { "properties": { "input_type": { "const": "MIXTURE_PROCESS_DOE_DESIGN" } }, "required": ["input_type"] },
      "then": { "required": ["components", "mixture_total", "factors", "design_space_reference"] }
    }
  ]
}
