{
  "input_type": "MIXTURE_DOE_DESIGN",
  "components": [
    {
      "component_id": "PAO6",
      "lower_bound": 0.0,
      "upper_bound": 1.0
    },
    {
      "component_id": "AN",
      "lower_bound": 0.0,
      "upper_bound": 1.0
    },
    {
      "component_id": "Ester",
      "lower_bound": 0.0,
      "upper_bound": 1.0
    },
    {
      "component_id": "Additive",
      "lower_bound": 0.0,
      "upper_bound": 1.0
    }
  ],
  "mixture_total": 1.0,
  "design_type": "D_OPTIMAL_MIXTURE",
  "model_order": "QUADRATIC",
  "target_runs": 15,
  "responses": [
    {
      "ctq_reference": "KV40",
      "test_method_reference": "ASTM D445",
      "role": "OPTIMIZATION_RESPONSE"
    },
    {
      "ctq_reference": "TAN",
      "test_method_reference": "ASTM D664",
      "role": "GUARDRAIL"
    }
  ],
  "experiment_card": {
    "decision_question": "What is the optimal PAO6/AN/Ester/Additive proportion to maximize KV40 within cost constraints?",
    "hypothesis": "Increasing ester content improves KV40 up to a quadratic optimum while AN moderates viscosity.",
    "variables_note": "Mixture variables: PAO6, AN, Ester, Additive constrained to sum to 1.0.",
    "constraints_note": "Bounds: PAO6 [0,1], AN [0,1], Ester [0,1], Additive [0,1] (wide feasible range for gold reference). Note: spec example PAO6[0.3,0.6]/AN[0.1,0.4]/Ester[0.05,0.3]/Additive[0.05,0.15] yields only 1 feasible candidate; unconstrained q=4 yields 39 feasible candidates with the current engine, so gold uses target 15 (>= the 10 quadratic Scheffe parameters).",
    "responses_note": "Responses: KV40 OPTIMIZATION_RESPONSE, TAN GUARDRAIL per ASTM methods.",
    "doe_selection_reason": "D-optimal mixture design maximizes determinant of Scheffe quadratic model information matrix.",
    "expected_information_value": "Information matrix determinant quantifies parameter precision for quadratic Scheffe model.",
    "decision_rule": "Select next formulation at highest predicted KV40 within 95 pct CI that passes TAN guardrail."
  }
}
